{
  "group_id": "EWM-MODAL-CTA_GRUPO_EJEMPLO",
  "title": "Ejemplo de Grupo v2 - Implementación de Feature",
  "status": "pending",
  "created_date": "2025-07-21T10:00:00Z",
  "author": "augment_agent",
  "objective": "Implementar una nueva funcionalidad de autenticación con validación de tokens JWT y manejo de sesiones",
  "success_criteria": "Sistema de autenticación funcionando con tests unitarios pasando, documentación completa y deployment exitoso",
  "constraints": "Debe ser compatible con la API existente y no romper funcionalidad actual",
  "checklist": [
    {
      "step": 1,
      "description": "Análisis de requerimientos y diseño de arquitectura",
      "completed": false,
      "notes": "Revisar especificaciones de JWT y patrones de autenticación"
    },
    {
      "step": 2,
      "description": "Implementación del middleware de autenticación",
      "completed": false,
      "notes": null
    },
    {
      "step": 3,
      "description": "Creación de endpoints de login/logout",
      "completed": false,
      "notes": null
    },
    {
      "step": 4,
      "description": "Implementación de validación de tokens",
      "completed": false,
      "notes": null
    },
    {
      "step": 5,
      "description": "Tests unitarios y de integración",
      "completed": false,
      "notes": "Incluir tests de edge cases y seguridad"
    },
    {
      "step": 6,
      "description": "Documentación y deployment",
      "completed": false,
      "notes": null
    }
  ],
  "technical_summary": {
    "technologies": [
      "Node.js",
      "Express.js",
      "JWT",
      "bcrypt",
      "Jest"
    ],
    "components": [
      "AuthMiddleware",
      "TokenService",
      "UserController",
      "SessionManager"
    ],
    "files": [
      "src/middleware/auth.js",
      "src/services/token.js",
      "src/controllers/user.js",
      "src/routes/auth.js",
      "tests/auth.test.js"
    ]
  },
  "metadata": {
    "priority": "high",
    "estimated_duration": "1 week",
    "tags": [
      "authentication",
      "security",
      "backend",
      "api"
    ],
    "related_groups": [
      "USER_MANAGEMENT_V2",
      "API_SECURITY_AUDIT"
    ]
  }
}
